ccs/asiaccs2014,2014,Keynote,Fighting malicious code: an eternal struggle.,Christopher Kruegel;,http://doi.acm.org/10.1145/2590296.2590348
ccs/asiaccs2014,2014,Network,Letting the puss in boots sweat: detecting fake access points using dependency of clock skews on temperature.,Fabian Lanze;Andriy Panchenko;Benjamin Braatz;Thomas Engel;,http://doi.acm.org/10.1145/2590296.2590333
ccs/asiaccs2014,2014,Network,Covert ephemeral communication in named data networking.,Moreno Ambrosin;Mauro Conti;Paolo Gasti;Gene Tsudik;,http://doi.acm.org/10.1145/2590296.2590306
ccs/asiaccs2014,2014,Network,Scanner hunter: understanding HTTP scanning traffic.,Guowu Xie;Huy Hang;Michalis Faloutsos;,http://doi.acm.org/10.1145/2590296.2590297
ccs/asiaccs2014,2014,Network,Detection of stealthy malware activities with traffic causality and scalable triggering relation discovery.,Hao Zhang;Danfeng (Daphne) Yao;Naren Ramakrishnan;,http://doi.acm.org/10.1145/2590296.2590309
ccs/asiaccs2014,2014,Network,Towards automated protocol reverse engineering using semantic information.,Georges Bossert;Frédéric Guihéry;Guillaume Hiet;,http://doi.acm.org/10.1145/2590296.2590346
ccs/asiaccs2014,2014,Reputation and location,Re3: relay reliability reputation for anonymity systems.,Anupam Das;Nikita Borisov;Prateek Mittal;Matthew Caesar;,http://doi.acm.org/10.1145/2590296.2590338
ccs/asiaccs2014,2014,Reputation and location,"Design and evaluation of persea, a sybil-resistant DHT.",Mahdi Nasrullah Al-Ameen;Matthew K. Wright;,http://doi.acm.org/10.1145/2590296.2590326
ccs/asiaccs2014,2014,Reputation and location,OTIT: towards secure provenance modeling for location proofs.,Rasib Khan;Shams Zawoad;Munirul M. Haque;Ragib Hasan;,http://doi.acm.org/10.1145/2590296.2590339
ccs/asiaccs2014,2014,Reputation and location,"Privacy-preserving distance computation and proximity testing on earth, done right.",Jaroslav Sedenka;Paolo Gasti;,http://doi.acm.org/10.1145/2590296.2590307
ccs/asiaccs2014,2014,Processing encrypted data,Maple: scalable multi-dimensional range search over encrypted cloud data with tree-based index.,Boyang Wang;Yantian Hou;Ming Li;Haitao Wang;Hui Li;,http://doi.acm.org/10.1145/2590296.2590305
ccs/asiaccs2014,2014,Processing encrypted data,Privacy of outsourced k-means clustering.,Dongxi Liu;Elisa Bertino;Xun Yi;,http://doi.acm.org/10.1145/2590296.2590332
ccs/asiaccs2014,2014,Processing encrypted data,PIDGIN: privacy-preserving interest and content sharing in opportunistic networks.,Muhammad Rizwan Asghar;Ashish Gehani;Bruno Crispo;Giovanni Russello;,http://doi.acm.org/10.1145/2590296.2590303
ccs/asiaccs2014,2014,Processing encrypted data,S-ORAM: a segmentation-based oblivious RAM.,Jinsheng Zhang;Wensheng Zhang;Daji Qiao;,http://doi.acm.org/10.1145/2590296.2590323
ccs/asiaccs2014,2014,Processing encrypted data,Differential privacy with δ-neighbourhood for spatial and dynamic datasets.,Chengfang Fang;Ee-Chien Chang;,http://doi.acm.org/10.1145/2590296.2590320
ccs/asiaccs2014,2014,Applications 1,On the effectiveness of risk prediction based on users browsing behavior.,Davide Canali;Leyla Bilge;Davide Balzarotti;,http://doi.acm.org/10.1145/2590296.2590347
ccs/asiaccs2014,2014,Applications 1,Protecting users against XSS-based password manager abuse.,Ben Stock;Martin Johns;,http://doi.acm.org/10.1145/2590296.2590336
ccs/asiaccs2014,2014,Applications 1,"A three-way investigation of a game-CAPTCHA: automated attacks, relay attacks and usability.",Manar Mohamed;Niharika Sachdeva;Michael Georgescu;Song Gao;Nitesh Saxena;Chengcui Zhang;Ponnurangam Kumaraguru;Paul C. van Oorschot;Wei-bang Chen;,http://doi.acm.org/10.1145/2590296.2590298
ccs/asiaccs2014,2014,Crypto,Modelling after-the-fact leakage for key exchange.,Janaka Alawatugoda;Douglas Stebila;Colin Boyd;,http://doi.acm.org/10.1145/2590296.2590317
ccs/asiaccs2014,2014,Crypto,Practical secret key agreement for full-duplex near field communications.,Rong Jin;Xianru Du;Zi Deng;Kai Zeng;Jing Xu;,http://doi.acm.org/10.1145/2590296.2590327
ccs/asiaccs2014,2014,Crypto,"Multi-recipient encryption, revisited.",Alexandre Pinto;Bertram Poettering;Jacob C. N. Schuldt;,http://doi.acm.org/10.1145/2590296.2590329
ccs/asiaccs2014,2014,Crypto,Fully secure key-policy attribute-based encryption with constant-size ciphertexts and fast decryption.,Junzuo Lai;Robert H. Deng;Yingjiu Li;Jian Weng;,http://doi.acm.org/10.1145/2590296.2590334
ccs/asiaccs2014,2014,Crypto,Improved anonymous proxy re-encryption with CCA security.,Qingji Zheng;Wei Zhu;Jiafeng Zhu;Xinwen Zhang;,http://doi.acm.org/10.1145/2590296.2590322
ccs/asiaccs2014,2014,Access control and flow analysis,"Efficient, context-aware privacy leakage confinement for android applications without firmware modding.",Mu Zhang;Heng Yin;,http://doi.acm.org/10.1145/2590296.2590312
ccs/asiaccs2014,2014,Access control and flow analysis,Malware detection with quantitative data flow graphs.,Tobias Wüchner;Martín Ochoa;Alexander Pretschner;,http://doi.acm.org/10.1145/2590296.2590319
ccs/asiaccs2014,2014,Access control and flow analysis,Abstract model counting: a novel approach for quantification of information leaks.,Quoc-Sang Phan;Pasquale Malacaria;,http://doi.acm.org/10.1145/2590296.2590328
ccs/asiaccs2014,2014,Access control and flow analysis,ConXsense: automated context classification for context-aware access control.,Markus Miettinen;Stephan Heuser;Wiebke Kronz;Ahmad-Reza Sadeghi;N. Asokan;,http://doi.acm.org/10.1145/2590296.2590337
ccs/asiaccs2014,2014,Software and systems security,On the feasibility of software attacks on commodity virtual machine monitors via direct device assignment.,Gábor Pék;Andrea Lanzi;Abhinav Srivastava;Davide Balzarotti;Aurélien Francillon;Christoph Neumann;,http://doi.acm.org/10.1145/2590296.2590299
ccs/asiaccs2014,2014,Software and systems security,After we knew it: empirical study and modeling of cost-effectiveness of exploiting prevalent known vulnerabilities across IaaS cloud.,Su Zhang;Xinwen Zhang;Xinming Ou;,http://doi.acm.org/10.1145/2590296.2590300
ccs/asiaccs2014,2014,Software and systems security,Prospect: peripheral proxying supported embedded code testing.,Markus Kammerstetter;Christian Platzer;Wolfgang Kastner;,http://doi.acm.org/10.1145/2590296.2590301
ccs/asiaccs2014,2014,Software and systems security,Scanning of real-world web applications for parameter tampering vulnerabilities.,Adonis P. H. Fung;Tielei Wang;K. W. Cheung;T. Y. Wong;,http://doi.acm.org/10.1145/2590296.2590324
ccs/asiaccs2014,2014,Applications 2,"The harvester, the botmaster, and the spammer: on the relations between the different actors in the spam landscape.",Gianluca Stringhini;Oliver Hohlfeld;Christopher Kruegel;Giovanni Vigna;,http://doi.acm.org/10.1145/2590296.2590302
ccs/asiaccs2014,2014,Applications 2,pTwitterRec: a privacy-preserving personalized tweet recommendation framework.,Bisheng Liu;Urs Hengartner;,http://doi.acm.org/10.1145/2590296.2590304
ccs/asiaccs2014,2014,Applications 2,Shades of gray: a closer look at emails in the gray area.,Jelena Isacenkova;Davide Balzarotti;,http://doi.acm.org/10.1145/2590296.2590344
ccs/asiaccs2014,2014,Authentication,Practical user authentication leveraging channel state information (CSI).,Hongbo Liu;Yan Wang;Jian Liu;Jie Yang;Yingying Chen;,http://doi.acm.org/10.1145/2590296.2590321
ccs/asiaccs2014,2014,Authentication,Outsourceable two-party privacy-preserving biometric authentication.,Hu Chun;Yousef Elmehdwi;Feng Li;Prabir Bhattacharya;Wei Jiang;,http://doi.acm.org/10.1145/2590296.2590343
ccs/asiaccs2014,2014,Authentication,Understanding OSN-based facial disclosure against face authentication systems.,Yan Li;Ke Xu;Qiang Yan;Yingjiu Li;Robert H. Deng;,http://doi.acm.org/10.1145/2590296.2590315
ccs/asiaccs2014,2014,Authentication,Tracing and revoking leaked credentials: accountability in leaking sensitive outsourced data.,Hua Deng;Qianhong Wu;Bo Qin;Sherman S. M. Chow;Josep Domingo-Ferrer;Wenchang Shi;,http://doi.acm.org/10.1145/2590296.2590342
ccs/asiaccs2014,2014,Authentication,Sufficient conditions for vertical composition of security protocols.,Sebastian Mödersheim;Luca Viganò;,http://doi.acm.org/10.1145/2590296.2590330
ccs/asiaccs2014,2014,Android,Evading android runtime analysis via sandbox detection.,Timothy Vidas;Nicolas Christin;,http://doi.acm.org/10.1145/2590296.2590325
ccs/asiaccs2014,2014,Android,VirtualSwindle: an automated attack against in-app billing on android.,Collin Mulliner;William K. Robertson;Engin Kirda;,http://doi.acm.org/10.1145/2590296.2590335
ccs/asiaccs2014,2014,Android,DroidRay: a security evaluation system for customized android firmwares.,Min Zheng;Mingshen Sun;John C. S. Lui;,http://doi.acm.org/10.1145/2590296.2590313
ccs/asiaccs2014,2014,Android,APKLancet: tumor payload diagnosis and purification for android applications.,Wenbo Yang;Juanru Li;Yuanyuan Zhang;Yong Li;Junliang Shu;Dawu Gu;,http://doi.acm.org/10.1145/2590296.2590314
ccs/asiaccs2014,2014,Short 1 -- network,How many down?: toward understanding systematic risk in networks.,Benjamin Johnson;Aron Laszka;Jens Grossklags;,http://doi.acm.org/10.1145/2590296.2590308
ccs/asiaccs2014,2014,Short 1 -- network,Prover anonymous and deniable distance-bounding authentication.,Sébastien Gambs;Cristina Onete;Jean-Marc Robert;,http://doi.acm.org/10.1145/2590296.2590331
ccs/asiaccs2014,2014,Short 1 -- network,Why eve and mallory (also) love webmasters: a study on the root causes of SSL misconfigurations.,Sascha Fahl;Yasemin Acar;Henning Perl;Matthew Smith;,http://doi.acm.org/10.1145/2590296.2590341
ccs/asiaccs2014,2014,Short 1 -- network,YourPassword: applying feedback loops to improve security behavior of managing multiple passwords.,Tiffany Hyun-Jin Kim;H. Colleen Stuart;Hsu-Chun Hsiao;Yue-Hsun Lin;Leon Zhang;Laura Dabbish;Sara B. Kiesler;,http://doi.acm.org/10.1145/2590296.2590345
ccs/asiaccs2014,2014,Short 1 -- software,Cyber defenses for physical attacks and insider threats in cloud computing.,Jakub Szefer;Pramod A. Jamkhedkar;Diego Perez-Botero;Ruby B. Lee;,http://doi.acm.org/10.1145/2590296.2590310
ccs/asiaccs2014,2014,Short 1 -- software,Monkey-in-the-browser: malware and vulnerabilities in augmented browsing script markets.,Steven Van Acker;Nick Nikiforakis;Lieven Desmet;Frank Piessens;Wouter Joosen;,http://doi.acm.org/10.1145/2590296.2590311
ccs/asiaccs2014,2014,Short 1 -- software,IntentFuzzer: detecting capability leaks of android applications.,Kun Yang;Jianwei Zhuge;Yongke Wang;Lujue Zhou;Haixin Duan;,http://doi.acm.org/10.1145/2590296.2590316
ccs/asiaccs2014,2014,Short 1 -- software,Remotely wiping sensitive data on stolen smartphones.,Xingjie Yu;Zhan Wang;Kun Sun;Wen Tao Zhu;Neng Gao;Jiwu Jing;,http://doi.acm.org/10.1145/2590296.2590318
