ccs/iotpts2016,2016,Keynote Address,Functional Credentials for Internet of Things.,Sherman S. M. Chow;,http://doi.acm.org/10.1145/2899007.2899014
ccs/iotpts2016,2016,Session 1:Primitives,High-Performance and Lightweight Lattice-Based Public-Key Encryption.,Johannes A. Buchmann;Florian Göpfert;Tim Güneysu;Tobias Oder;Thomas Pöppelmann;,http://doi.acm.org/10.1145/2899007.2899011
ccs/iotpts2016,2016,Session 1:Primitives,Position Paper: Physical Unclonable Functions for IoT Security.,Muhammad Naveed Aman;Kee Chaing Chua;Biplab Sikdar;,http://doi.acm.org/10.1145/2899007.2899013
ccs/iotpts2016,2016,Session 1:Primitives,Trusted Sensors for Participatory Sensing and IoT Applications based on Physically Unclonable Functions.,Ihtesham Haider;Michael Höberl;Bernhard Rinner;,http://doi.acm.org/10.1145/2899007.2899010
ccs/iotpts2016,2016,Session 2:Attacks & Applications,Analyzing the Security and Privacy of Cloud-based Video Surveillance Systems.,Johannes Obermaier;Martin Hutle;,http://doi.acm.org/10.1145/2899007.2899008
ccs/iotpts2016,2016,Session 2:Attacks & Applications,Cloud-Based Commissioning of Constrained Devices using Permissioned Blockchains.,Thomas Hardjono;Ned M. Smith;,http://doi.acm.org/10.1145/2899007.2899012
ccs/iotpts2016,2016,Session 2:Attacks & Applications,Mind The Plug! Laptop-User Recognition Through Power Consumption.,Mauro Conti;Michele Nati;Enrico Rotundo;Riccardo Spolaor;,http://doi.acm.org/10.1145/2899007.2899009
