ccs/siw2014,2014,Tools,Exploring the Usability of Open Source Network Forensic Tools.,Erik E. Northrop;Heather Richter Lipford;,http://doi.acm.org/10.1145/2663887.2663903
ccs/siw2014,2014,Tools,ACH Walkthrough: A Distributed Multi-Device Tool for Collaborative Security Analysis.,Jeff Wilson;Judith M. Brown;Robert Biddle;,http://doi.acm.org/10.1145/2663887.2663902
ccs/siw2014,2014,Tools,Interactive Code Annotation for Security Vulnerability Detection.,Heather Richter Lipford;Tyler Thomas;Bill Chu;Emerson R. Murphy-Hill;,http://doi.acm.org/10.1145/2663887.2663901
ccs/siw2014,2014,Software Development,Technical and Personal Factors Influencing Developers' Adoption of Security Tools.,Jim Witschey;Shundan Xiao;Emerson R. Murphy-Hill;,http://doi.acm.org/10.1145/2663887.2663898
ccs/siw2014,2014,Software Development,Comparative Evaluation of Architectural and Code-Level Approaches for Finding Security Vulnerabilities.,Radu Vanciu;Ebrahim Khalaj;Marwan Abi-Antoun;,http://doi.acm.org/10.1145/2663887.2663905
ccs/siw2014,2014,Software Development,Designing Interventions to Persuade Software Developers to Adopt Security Tools.,Tiffany Brooke Jordan;Brittany Johnson;Jim Witschey;Emerson R. Murphy-Hill;,http://doi.acm.org/10.1145/2663887.2663900
ccs/siw2014,2014,Operations,Human-Centered Study of a Network Operations Center: Experience Report and Lessons Learned.,Celeste Lyn Paul;,http://doi.acm.org/10.1145/2663887.2663899
ccs/siw2014,2014,Operations,A Tale of Three Security Operation Centers.,Sathya Chandran Sundaramurthy;Jacob Case;Tony Truong;Loai Zomlot;Marcel Hoffmann;,http://doi.acm.org/10.1145/2663887.2663904
ccs/siw2014,2014,Operations,An Exploratory Study of White Hat Behaviors in a Web Vulnerability Disclosure Program.,Mingyi Zhao;Jens Grossklags;Kai Chen;,http://doi.acm.org/10.1145/2663887.2663906
