compsec/compsec19,1 December 2000,Number 8,Internet Biz Group Calls for Cybercrime Treaty Delay.,Bill Hancock;,https://doi.org/10.1016/S0167-4048(00)08009-3
compsec/compsec19,1 December 2000,Number 8,Laptop Theft Now Targeted Towards Data and Not Necessarily Hardware.,Bill Hancock;,https://doi.org/10.1016/S0167-4048(00)08010-X
compsec/compsec19,1 December 2000,Number 8,Hacktivism Increasing.,Bill Hancock;,https://doi.org/10.1016/S0167-4048(00)08011-1
compsec/compsec19,1 December 2000,Number 8,US Department of Defense Prepares Cybercrime Database.,Bill Hancock;,https://doi.org/10.1016/S0167-4048(00)08012-3
compsec/compsec19,1 December 2000,Number 8,CIA Chat Room Causes Grief.,Bill Hancock;,https://doi.org/10.1016/S0167-4048(00)08013-5
compsec/compsec19,1 December 2000,Number 8,Japan Creates Cyberconditions for IT National Revolution.,Bill Hancock;,https://doi.org/10.1016/S0167-4048(00)08014-7
compsec/compsec19,1 December 2000,Number 8,US Privacy Law Proposals Cause Concerns.,Bill Hancock;,https://doi.org/10.1016/S0167-4048(00)08015-9
compsec/compsec19,1 December 2000,Number 8,New Names For Old - A Personal Surf Through Compsec 200.,Stephen Hinde;,https://doi.org/10.1016/S0167-4048(00)08016-0
compsec/compsec19,1 December 2000,Number 8,America's Internet Commerce and The Threat of Fraud.,August Bequai;,https://doi.org/10.1016/S0167-4048(00)08017-2
compsec/compsec19,1 December 2000,Number 8,The Software Colander Holes in Messagin.,Andy Clarke;Vince Gallo;,https://doi.org/10.1016/S0167-4048(00)08018-4
compsec/compsec19,1 December 2000,Number 8,Information Security Management: An Approach to Combine Process Certification And Product Evaluation.,Mariki M. Eloff;Sebastiaan H. von Solms;,https://doi.org/10.1016/S0167-4048(00)08019-6
compsec/compsec19,1 December 2000,Number 8,Opening Up The Enterprise.,John Sherwood;,https://doi.org/10.1016/S0167-4048(00)08020-2
compsec/compsec19,1 December 2000,Number 8,Securing The Electronic Market: The KEYSTONE Public Key Infrastructure Architecture.,Stefanos Gritzalis;Sokratis K. Katsikas;Dimitrios Lekkas;Konstantinos Moulinos;Eleni Polydoro;,https://doi.org/10.1016/S0167-4048(00)08022-6
