uss/evt-wote2014,2014,Fraud and Error in Practice,Do New Voting Technologies Prevent Fraud? Evidence from Russia.,Max Bader;,https://www.usenix.org/conference/evtwote14/workshop-program/presentation/bader
uss/evt-wote2014,2014,Fraud and Error in Practice,A Systematic Approach to Analyzing Voting Terminal Event Logs.,Laurent D. Michel;Alexander A. Shvartsman;Nikolaj Volgushev;,https://www.usenix.org/conference/evtwote14/workshop-program/presentation/michel
uss/evt-wote2014,2014,Usability and Accessibility,"Do Voters and Poll Workers Differ in their Attitudes Toward E-voting? Evidence from the First E-election in Salta, Argentina.",Julia Pomares;Inés Levin;R. Michael Alvarez;,https://www.usenix.org/conference/evtwote14/workshop-program/presentation/pomares
uss/evt-wote2014,2014,Usability and Accessibility,Making Voting Accessible: Designing Digital Ballot Marking for People with Low Literacy and Mild Cognitive Disabilities.,Kathryn Summers;Dana Chisnell;Drew Davies;Noel T. Alton;Megan McKeever;,https://www.usenix.org/conference/evtwote14/workshop-program/presentation/summers
uss/evt-wote2014,2014,New Crypto Schemes,Every Vote Counts: Ensuring Integrity in Large-Scale Electronic Voting.,Feng Hao;Matthew Nicolas Kreeger;Brian Randell;Dylan Clarke;Siamak Fayyaz Shahandashti;Peter Hyun-Jeen Lee;,https://www.usenix.org/conference/evtwote14/workshop-program/presentation/hao
uss/evt-wote2014,2014,E2E in Practice,Faster Print on Demand for Prêt à Voter.,Chris Culnane;James Heather;Rui Joaquim;Peter Y. A. Ryan;Steve Schneider;Vanessa Teague;,https://www.usenix.org/conference/evtwote14/workshop-program/presentation/culnane
uss/evt-wote2014,2014,E2E in Practice,"Usability of Voter Verifiable, End-to-end Voting Systems: Baseline Data for Helios, Prêt à Voter, and Scantegrity II.",Claudia Z. Acemyan;Philip T. Kortum;Michael D. Byrne;Dan S. Wallach;,https://www.usenix.org/conference/evtwote14/workshop-program/presentation/acemyan
