uss/uss2011,2011,Web Security,Fast and Precise Sanitizer Analysis with BEK.,Pieter Hooimeijer;Benjamin Livshits;David Molnar;Prateek Saxena;Margus Veanes;,http://static.usenix.org/events/sec11/tech/full_papers/Hooimeijer.pdf
uss/uss2011,2011,Web Security,Toward Secure Embedded Web Interfaces.,Baptiste Gourdin;Chinmay Soman;Hristo Bojinov;Elie Bursztein;,http://static.usenix.org/events/sec11/tech/full_papers/Gourdin.pdf
uss/uss2011,2011,Web Security,ZOZZLE: Fast and Precise In-Browser JavaScript Malware Detection.,Charlie Curtsinger;Benjamin Livshits;Benjamin G. Zorn;Christian Seifert;,http://static.usenix.org/events/sec11/tech/full_papers/Curtsinger.pdf
uss/uss2011,2011,Analysis of Deployed Systems,Why (Special Agent) Johnny (Still) Can't Encrypt: A Security Analysis of the APCO Project 25 Two-Way Radio System.,Sandy Clark;Travis Goodspeed;Perry Metzger;Zachary Wasserman;Kevin Xu;Matt Blaze;,http://static.usenix.org/events/sec11/tech/full_papers/Clark.pdf
uss/uss2011,2011,Analysis of Deployed Systems,Dark Clouds on the Horizon: Using Cloud Storage as Attack Vector and Online Slack Space.,Martin Mulazzani;Sebastian Schrittwieser;Manuel Leithner;Markus Huber;Edgar R. Weippl;,http://static.usenix.org/events/sec11/tech/full_papers/Mulazzani6-24-11.pdf
uss/uss2011,2011,Analysis of Deployed Systems,Comprehensive Experimental Analyses of Automotive Attack Surfaces.,Stephen Checkoway;Damon McCoy;Brian Kantor;Danny Anderson;Hovav Shacham;Stefan Savage;Karl Koscher;Alexei Czeskis;Franziska Roesner;Tadayoshi Kohno;,http://static.usenix.org/events/sec11/tech/full_papers/Checkoway.pdf
uss/uss2011,2011,Forensic Analysis,Forensic Triage for Mobile Phones with DEC0DE.,Robert J. Walls;Erik G. Learned-Miller;Brian Neil Levine;,http://static.usenix.org/events/sec11/tech/full_papers/Walls.pdf
uss/uss2011,2011,Forensic Analysis,mCarve: Carving Attributed Dump Sets.,Ton van Deursen;Sjouke Mauw;Sasa Radomirovic;,http://static.usenix.org/events/sec11/tech/full_papers/Deursen.pdf
uss/uss2011,2011,Forensic Analysis,SHELLOS: Enabling Fast Detection and Forensic Analysis of Code Injection Attacks.,Kevin Z. Snow;Srinivas Krishnan;Fabian Monrose;Niels Provos;,http://static.usenix.org/events/sec11/tech/full_papers/Snow.pdf
uss/uss2011,2011,Static and Dynamic Analysis,MACE: Model-inference-Assisted Concolic Exploration for Protocol and Vulnerability Discovery.,Chia Yuan Cho;Domagoj Babic;Pongsin Poosankam;Kevin Zhijie Chen;Edward XueJun Wu;Dawn Song;,http://static.usenix.org/events/sec11/tech/full_papers/Cho.pdf
uss/uss2011,2011,Static and Dynamic Analysis,Static Detection of Access Control Vulnerabilities in Web Applications.,Fangqi Sun;Liang Xu;Zhendong Su;,http://static.usenix.org/events/sec11/tech/full_papers/Sun.pdf
uss/uss2011,2011,Static and Dynamic Analysis,ADsafety: Type-Based Verification of JavaScript Sandboxing.,Joe Gibbs Politz;Spiridon Aristides Eliopoulos;Arjun Guha;Shriram Krishnamurthi;,http://static.usenix.org/events/sec11/tech/full_papers/Politz.pdf
uss/uss2011,2011,Understanding the Underground Economy,Measuring Pay-per-Install: The Commoditization of Malware Distribution.,Juan Caballero;Chris Grier;Christian Kreibich;Vern Paxson;,http://static.usenix.org/events/sec11/tech/full_papers/Caballero.pdf
uss/uss2011,2011,Understanding the Underground Economy,Dirty Jobs: The Role of Freelance Labor in Web Service Abuse.,Marti Motoyama;Damon McCoy;Kirill Levchenko;Stefan Savage;Geoffrey M. Voelker;,http://static.usenix.org/events/sec11/tech/full_papers/Motoyama.pdf
uss/uss2011,2011,Understanding the Underground Economy,Show Me the Money: Characterizing Spam-advertised Revenue.,Chris Kanich;Nicholas Weaver;Damon McCoy;Tristan Halvorson;Christian Kreibich;Kirill Levchenko;Vern Paxson;Geoffrey M. Voelker;Stefan Savage;,http://static.usenix.org/events/sec11/tech/full_papers/Kanich.pdf
uss/uss2011,2011,Defenses and New Directions,Secure In-Band Wireless Pairing.,Shyamnath Gollakota;Nabeel Ahmed;Nickolai Zeldovich;Dina Katabi;,http://static.usenix.org/events/sec11/tech/full_papers/Gollakota.pdf
uss/uss2011,2011,Defenses and New Directions,TRESOR Runs Encryption Securely Outside RAM.,Tilo Müller;Felix C. Freiling;Andreas Dewald;,http://static.usenix.org/events/sec11/tech/full_papers/Muller.pdf
uss/uss2011,2011,Defenses and New Directions,Bubble Trouble: Off-Line De-Anonymization of Bubble Forms.,Joseph A. Calandrino;William Clarkson;Edward W. Felten;,http://static.usenix.org/events/sec11/tech/full_papers/Calandrino.pdf
uss/uss2011,2011,Securing Search,Measuring and Analyzing Search-Redirection Attacks in the Illicit Online Prescription Drug Trade.,Nektarios Leontiadis;Tyler Moore;Nicolas Christin;,http://static.usenix.org/events/sec11/tech/full_papers/Leontiadis.pdf
uss/uss2011,2011,Securing Search,deSEO: Combating Search-Result Poisoning.,John P. John;Fang Yu;Yinglian Xie;Arvind Krishnamurthy;Martín Abadi;,http://static.usenix.org/events/sec11/tech/full_papers/John.pdf
uss/uss2011,2011,Securing Smart Phones,A Study of Android Application Security.,William Enck;Damien Octeau;Patrick D. McDaniel;Swarat Chaudhuri;,http://static.usenix.org/events/sec11/tech/full_papers/Enck.pdf
uss/uss2011,2011,Securing Smart Phones,Permission Re-Delegation: Attacks and Defenses.,Adrienne Porter Felt;Helen J. Wang;Alexander Moshchuk;Steve Hanna;Erika Chin;,http://static.usenix.org/events/sec11/tech/full_papers/Felt.pdf
uss/uss2011,2011,Securing Smart Phones,QUIRE: Lightweight Provenance for Smart Phone Operating Systems.,Michael Dietz;Shashi Shekhar;Yuliy Pisetsky;Anhei Shu;Dan S. Wallach;,http://static.usenix.org/events/sec11/tech/full_papers/Dietz7-26-11.pdf
uss/uss2011,2011,Understanding Attacks,SMS of Death: From Analyzing to Attacking Mobile Phones on a Large Scale.,Collin Mulliner;Nico Golde;Jean-Pierre Seifert;,http://static.usenix.org/events/sec11/tech/full_papers/Mulliner.pdf
uss/uss2011,2011,Understanding Attacks,Q: Exploit Hardening Made Easy.,Edward J. Schwartz;Thanassis Avgerinos;David Brumley;,http://static.usenix.org/events/sec11/tech/full_papers/Schwartz.pdf
uss/uss2011,2011,Understanding Attacks,Cloaking Malware with the Trusted Platform Module.,Alan M. Dunn;Owen S. Hofmann;Brent Waters;Emmett Witchel;,http://static.usenix.org/events/sec11/tech/full_papers/Dunn.pdf
uss/uss2011,2011,Dealing with Malware and Bots,Detecting Malware Domains at the Upper DNS Hierarchy.,Manos Antonakakis;Roberto Perdisci;Wenke Lee;Nikolaos Vasiloglou;David Dagon;,http://static.usenix.org/events/sec11/tech/full_papers/Antonakakis.pdf
uss/uss2011,2011,Dealing with Malware and Bots,BOTMAGNIFIER: Locating Spambots on the Internet.,Gianluca Stringhini;Thorsten Holz;Brett Stone-Gross;Christopher Kruegel;Giovanni Vigna;,http://static.usenix.org/events/sec11/tech/full_papers/Stringhini.pdf
uss/uss2011,2011,Dealing with Malware and Bots,JACKSTRAWS: Picking Command and Control Connections from Bot Traffic.,Grégoire Jacob;Ralf Hund;Christopher Kruegel;Thorsten Holz;,http://static.usenix.org/events/sec11/tech/full_papers/Jacob.pdf
uss/uss2011,2011,Privacy- and Freedom-Enhancing Technologies,Telex: Anticensorship in the Network Infrastructure.,Eric Wustrow;Scott Wolchok;Ian Goldberg;J. Alex Halderman;,http://static.usenix.org/events/sec11/tech/full_papers/Wustrow.pdf
uss/uss2011,2011,Privacy- and Freedom-Enhancing Technologies,PIR-Tor: Scalable Anonymous Communication Using Private Information Retrieval.,Prateek Mittal;Femi G. Olumofin;Carmela Troncoso;Nikita Borisov;Ian Goldberg;,http://static.usenix.org/events/sec11/tech/full_papers/Mittal.pdf
uss/uss2011,2011,Privacy- and Freedom-Enhancing Technologies,The Phantom Tollbooth: Privacy-Preserving Electronic Toll Collection in the Presence of Driver Collusion.,Sarah Meiklejohn;Keaton Mowery;Stephen Checkoway;Hovav Shacham;,http://static.usenix.org/events/sec11/tech/full_papers/Meiklejohn.pdf
uss/uss2011,2011,Applied Cryptography,Differential Privacy Under Fire.,Andreas Haeberlen;Benjamin C. Pierce;Arjun Narayan;,http://static.usenix.org/events/sec11/tech/full_papers/Haeberlen.pdf
uss/uss2011,2011,Applied Cryptography,Outsourcing the Decryption of ABE Ciphertexts.,Matthew Green;Susan Hohenberger;Brent Waters;,http://static.usenix.org/events/sec11/tech/full_papers/Green.pdf
uss/uss2011,2011,Applied Cryptography,Faster Secure Two-Party Computation Using Garbled Circuits.,Yan Huang;David Evans;Jonathan Katz;Lior Malka;,http://static.usenix.org/events/sec11/tech/full_papers/Huang.pdf
