acsac/pprew2015,2015,None,Applying Software Protection to White-Box Cryptography.,Michael J. Wiener;,http://doi.acm.org/10.1145/2843859.2846054
acsac/pprew2015,2015,None,InputFinder: Reverse Engineering Closed Binaries using Hardware Performance Counters.,Bogdan Copos;Praveen Murthy;,http://doi.acm.org/10.1145/2843859.2843865
acsac/pprew2015,2015,None,A Complement to Enhanced Instruction Register File against Embedded Software Falsification.,Naoki Fujieda;Kiyohiro Sato;Shuichi Ichikawa;,http://doi.acm.org/10.1145/2843859.2843864
acsac/pprew2015,2015,None,Repeatable Reverse Engineering with PANDA.,Brendan Dolan-Gavitt;Josh Hodosh;Patrick Hulin;Tim Leek;Ryan Whelan;,http://doi.acm.org/10.1145/2843859.2843867
acsac/pprew2015,2015,None,Lightweight heuristics to retrieve parameter associations from binaries.,Franck de Goër;Roland Groz;Laurent Mounier;,http://doi.acm.org/10.1145/2843859.2843861
acsac/pprew2015,2015,None,Flowtables: Program Skeletal Inversion for Defeat of Interprocedural Analysis with Unique Metamorphism.,Luke Jones;Ryan Whelan;Jeremy Blackthorne;Graham Baker;,http://doi.acm.org/10.1145/2843859.2843863
acsac/pprew2015,2015,None,OpSeq: Android Malware Fingerprinting.,Aisha Ali Gombe;Irfan Ahmed;Golden G. Richard III;Vassil Roussev;,http://doi.acm.org/10.1145/2843859.2843860
acsac/pprew2015,2015,None,Pinpointing and Hiding Surprising Fragments in an Obfuscated Program.,Yuichiro Kanzaki;Clark D. Thomborson;Akito Monden;Christian S. Collberg;,http://doi.acm.org/10.1145/2843859.2843862
acsac/pprew2015,2015,None,Enriching reverse engineering through visual exploration of Android binaries.,Ashutosh Jain;Hugo Gonzalez;Natalia Stakhanova;,http://doi.acm.org/10.1145/2843859.2843866
