esorics/esorics2014-2,2014,None,Public-Key Revocation and Tracing Schemes with Subset Difference Methods Revisited.,Kwangsu Lee;Woo Kwon Koo;Dong Hoon Lee;Jong Hwan Park;,https://doi.org/10.1007/978-3-319-11212-1_1
esorics/esorics2014-2,2014,None,NORX: Parallel and Scalable AEAD.,Jean-Philippe Aumasson;Philipp Jovanovic;Samuel Neves;,https://doi.org/10.1007/978-3-319-11212-1_2
esorics/esorics2014-2,2014,None,Even More Practical Secure Logging: Tree-Based Seekable Sequential Key Generators.,Giorgia Azzurra Marson;Bertram Poettering;,https://doi.org/10.1007/978-3-319-11212-1_3
esorics/esorics2014-2,2014,None,Large Universe Ciphertext-Policy Attribute-Based Encryption with White-Box Traceability.,Jianting Ning;Zhenfu Cao;Xiaolei Dong;Lifei Wei;Xiaodong Lin;,https://doi.org/10.1007/978-3-319-11212-1_4
esorics/esorics2014-2,2014,None,PPDCP-ABE: Privacy-Preserving Decentralized Ciphertext-Policy Attribute-Based Encryption.,Jinguang Han;Willy Susilo;Yi Mu;Jianying Zhou;Man Ho Au;,https://doi.org/10.1007/978-3-319-11212-1_5
esorics/esorics2014-2,2014,None,Practical Direct Chosen Ciphertext Secure Key-Policy Attribute-Based Encryption with Public Ciphertext Test.,Weiran Liu;Jianwei Liu;Qianhong Wu;Bo Qin;Yunya Zhou;,https://doi.org/10.1007/978-3-319-11212-1_6
esorics/esorics2014-2,2014,None,Privacy-Preserving Auditing for Attribute-Based Credentials.,Jan Camenisch;Anja Lehmann;Gregory Neven;Alfredo Rial;,https://doi.org/10.1007/978-3-319-11212-1_7
esorics/esorics2014-2,2014,None,What's the Gist? Privacy-Preserving Aggregation of User Profiles.,Igor Bilogrevic;Julien Freudiger;Emiliano De Cristofaro;Ersin Uzun;,https://doi.org/10.1007/978-3-319-11212-1_8
esorics/esorics2014-2,2014,None,Challenging Differential Privacy: The Case of Non-interactive Mechanisms.,Raghavendran Balu;Teddy Furon;Sébastien Gambs;,https://doi.org/10.1007/978-3-319-11212-1_9
esorics/esorics2014-2,2014,None,Optimality and Complexity of Inference-Proof Data Filtering and CQE.,Joachim Biskup;Piero A. Bonatti;Clemente Galdi;Luigi Sauro;,https://doi.org/10.1007/978-3-319-11212-1_10
esorics/esorics2014-2,2014,None,New Insight to Preserve Online Survey Accuracy and Privacy in Big Data Era.,Joseph K. Liu;Man Ho Au;Xinyi Huang;Willy Susilo;Jianying Zhou;Yong Yu;,https://doi.org/10.1007/978-3-319-11212-1_11
esorics/esorics2014-2,2014,None,Software Countermeasures for Control Flow Integrity of Smart Card C Codes.,Jean-François Lalande;Karine Heydemann;Pascal Berthomé;,https://doi.org/10.1007/978-3-319-11212-1_12
esorics/esorics2014-2,2014,None,LeakWatch: Estimating Information Leakage from Java Programs.,Tom Chothia;Yusuke Kawamoto;Chris Novakovic;,https://doi.org/10.1007/978-3-319-11212-1_13
esorics/esorics2014-2,2014,None,SigPath: A Memory Graph Based Approach for Program Data Introspection and Modification.,David I. Urbina;Yufei Gu;Juan Caballero;Zhiqiang Lin;,https://doi.org/10.1007/978-3-319-11212-1_14
esorics/esorics2014-2,2014,None,ID-Based Two-Server Password-Authenticated Key Exchange.,Xun Yi;Feng Hao;Elisa Bertino;,https://doi.org/10.1007/978-3-319-11212-1_15
esorics/esorics2014-2,2014,None,Modelling Time for Authenticated Key Exchange Protocols.,Jörg Schwenk;,https://doi.org/10.1007/978-3-319-11212-1_16
esorics/esorics2014-2,2014,None,Zero-Knowledge Password Policy Checks and Verifier-Based PAKE.,Franziskus Kiefer;Mark Manulis;,https://doi.org/10.1007/978-3-319-11212-1_17
esorics/esorics2014-2,2014,None,Bitcoin Transaction Malleability and MtGox.,Christian Decker;Roger Wattenhofer;,https://doi.org/10.1007/978-3-319-11212-1_18
esorics/esorics2014-2,2014,None,Election Verifiability for Helios under Weaker Trust Assumptions.,Véronique Cortier;David Galindo;Stéphane Glondu;Malika Izabachène;,https://doi.org/10.1007/978-3-319-11212-1_19
esorics/esorics2014-2,2014,None,CoinShuffle: Practical Decentralized Coin Mixing for Bitcoin.,Tim Ruffing;Pedro Moreno-Sanchez;Aniket Kate;,https://doi.org/10.1007/978-3-319-11212-1_20
esorics/esorics2014-2,2014,None,LESS Is More: Host-Agent Based Simulator for Large-Scale Evaluation of Security Systems.,John Sonchack;Adam J. Aviv;,https://doi.org/10.1007/978-3-319-11212-1_21
esorics/esorics2014-2,2014,None,Detecting Insider Information Theft Using Features from File Access Logs.,Christopher S. Gates;Ninghui Li;Zenglin Xu;Suresh N. Chari;Ian Molloy;Youngja Park;,https://doi.org/10.1007/978-3-319-11212-1_22
esorics/esorics2014-2,2014,None,SRID: State Relation Based Intrusion Detection for False Data Injection Attacks in SCADA.,Yong Wang;Zhaoyan Xu;Jialong Zhang;Lei Xu;Haopei Wang;Guofei Gu;,https://doi.org/10.1007/978-3-319-11212-1_23
esorics/esorics2014-2,2014,None,Click Fraud Detection on the Advertiser Side.,Haitao Xu;Daiping Liu;Aaron Koehl;Haining Wang;Angelos Stavrou;,https://doi.org/10.1007/978-3-319-11212-1_24
esorics/esorics2014-2,2014,None,Botyacc: Unified P2P Botnet Detection Using Behavioural Analysis and Graph Analysis.,Shishir Nagaraja;,https://doi.org/10.1007/978-3-319-11212-1_25
esorics/esorics2014-2,2014,None,Feature-Distributed Malware Attack: Risk and Defence.,Byungho Min;Vijay Varadharajan;,https://doi.org/10.1007/978-3-319-11212-1_26
esorics/esorics2014-2,2014,None,RootkitDet: Practical End-to-End Defense against Kernel Rootkits in a Cloud Environment.,Lingchen Zhang;Sachin Shetty;Peng Liu;Jiwu Jing;,https://doi.org/10.1007/978-3-319-11212-1_27
esorics/esorics2014-2,2014,None,Modeling Network Diversity for Evaluating the Robustness of Networks against Zero-Day Attacks.,Lingyu Wang;Mengyuan Zhang;Sushil Jajodia;Anoop Singhal;Massimiliano Albanese;,https://doi.org/10.1007/978-3-319-11212-1_28
